{"candidate_id":"atlas-research-fixture-v1-candidate","changed_variable":{"new_value":2,"old_value":1,"path":"weights.quality"},"created_at":"2026-08-29T00:00:00Z","evaluation_payload":{"external_schema":{"id":"urn:atlasrepo:atlas-research:fixture:v1:linear-evaluator","version":"1.0.0"},"media_type":"application/json","producer":{"name":"atlas-research","version":"0.1.0"},"role":"evaluation_payload","sha256":"d367108b3665febc4678fc560fbbaa9634f27197d1c3705826af28c359958e31","size_bytes":103,"uri":"candidate-payload.json"},"generator":{"kind":"human"},"hypothesis":"Increase one synthetic quality weight from 1 to 2.","parent_evaluation_payload":{"external_schema":{"id":"urn:atlasrepo:atlas-research:fixture:v1:linear-evaluator","version":"1.0.0"},"media_type":"application/json","producer":{"name":"atlas-research","version":"0.1.0"},"role":"evaluation_payload","sha256":"91d0a4decc8caee12120d7a15a8ce17558f9aebf9b29849a68c1b21453aaa7b1","size_bytes":103,"uri":"baseline.json"},"research_level":"LEVEL_2","schema_version":"1.0.0","status":"proposed","target_contract":{"id":"urn:atlasrepo:scout:scoring-definition","version":"1.0.0"}}
